{
  "schema_version": "1.0.0",
  "passport_id": "fp_alex2026",
  "version": 1,
  "owner_ref": "user.alex",
  "title": "Alex's portable feed",
  "intent_summary": "Independent games, design, local culture, and research without automated public engagement.",
  "status": "active",
  "created_at": "2026-08-29T10:00:00Z",
  "updated_at": "2026-08-29T10:05:00Z",
  "topics": [
    {
      "topic_id": "independent_games",
      "label": "Independent games",
      "target_percent": 35
    },
    {
      "topic_id": "design",
      "label": "Design",
      "target_percent": 30
    },
    {
      "topic_id": "local_culture",
      "label": "Local culture",
      "target_percent": 20
    },
    {
      "topic_id": "research",
      "label": "Research",
      "target_percent": 15
    }
  ],
  "cross_cutting": {
    "serendipity_percent": 20,
    "outrage_ceiling_percent": 5,
    "maximum_source_share_percent": 30
  },
  "languages": [
    "en",
    "de"
  ],
  "formats": [
    {
      "format": "long_text",
      "label": "long_text",
      "preference": "prefer",
      "weight": 0.9
    },
    {
      "format": "short_video",
      "label": "short_video",
      "preference": "avoid",
      "weight": 0.3
    }
  ],
  "hard_exclusions": [
    {
      "exclusion_id": "exclude.outragebait",
      "kind": "topic",
      "value": "outrage bait",
      "reason": "The user explicitly capped outrage-oriented material."
    }
  ],
  "creator_preferences": [
    {
      "creator_ref": "creator.studio_one",
      "display_name": "Studio One",
      "intent": "follow",
      "identity_confidence": 0.98,
      "verified_cross_link": true
    }
  ],
  "provenance": [
    {
      "evidence_ref": "intent.alex.001",
      "kind": "explicit_user_intent",
      "collected_at": "2026-08-29T10:00:00Z",
      "confidence": 1
    },
    {
      "evidence_ref": "fixture.source.001",
      "kind": "lab_fixture",
      "collected_at": "2026-08-29T10:01:00Z",
      "confidence": 1
    }
  ],
  "sharing_defaults": {
    "share_topics": true,
    "share_creator_preferences": false,
    "share_hard_exclusions": false,
    "raw_history_included": false
  },
  "trust_boundary": {
    "credentials_in_model_context": false,
    "public_engagement_automation": false,
    "raw_private_history_transfer": false
  }
}
